,adult,backdrop_path,genre_ids,id,original_language,original_title,overview,popularity,poster_path,release_date,title,video,vote_average,vote_count,character0,character1,character2
264,False,/si4PH5RjbpdQZi3BQvV6eiBNjYD.jpg,"[27, 28, 53, 878]",348,en,Alien,"During its return to the earth, commercial spaceship Nostromo intercepts a distress signal from a distant planet. When a three-member team of the crew discovers a chamber containing thousands of eggs on the planet, a creature inside one of the eggs attacks an explorer. The entire crew is unaware of the impending nightmare set to descend upon them when the alien parasite planted inside its unfortunate host is birthed.",5.621786,/2h00HrZs89SL3tXB4nbkiM7BKHs.jpg,1979-05-25,Alien,False,7.56,2569,Ripley,Dallas,Lambert
265,False,/yaps1kzbHVxTpCmuMgWm8zaTdnN.jpg,"[12, 28, 53, 878]",9659,en,Mad Max,"In a dystopic future Australia, a vicious biker gang murder a cop's family, and makes his fight with them personal.",3.408636,/uc0kLg1UX0ao62O46hdPIFYz8oz.jpg,1979-04-12,Mad Max,False,6.5,624,Mad Max Rockatansky,Jessie Rockatansky,Toecutter
266,False,/s2z4t3y5gvFKId09smKOUq8I8gK.jpg,"[18, 27, 53]",11449,en,The Amityville Horror,"George Lutz and his wife Kathleen, move into their Long Island dream house with their children only for their lives to be turned into a hellish nightmare. The legacy of a murder committed in the house gradually affects the family and a priest is brought in to try and exorcise the demonic presence from their home.",1.78597,/8wcBjXqu4VtUV0mPyah6WB0mMKR.jpg,1979-07-27,The Amityville Horror,False,6.2,76,George Lutz,Kathy Lutz,Father Delaney
267,False,/k91Dag8AZbhjIJqrtf7F1bQnGPg.jpg,"[18, 10752]",28,en,Apocalypse Now,"At the height of the Vietnam war, Captain Benjamin Willard is sent on a dangerous mission that, officially, ""does not exist, nor will it ever exist."" His goal is to locate - and eliminate - a mysterious Green Beret Colonel named Walter Kurtz, who has been leading his personal army on illegal guerrilla missions into enemy territory.",3.961984,/l8dn7rKbjP36PtHsViHGpzf5ey7.jpg,1979-08-15,Apocalypse Now,False,7.81,1017,Captain Benjamin L. Willard,Colonel Walter E. Kurtz,Lieutenant Colonel Bill Kilgore
268,False,/bJMPdI1EfzkLPrgbBCCYrBXBY49.jpg,"[12, 35, 10751]",11176,en,The Muppet Movie,"Kermit the Frog is persuaded by agent Dom DeLuise to pursue a career in Hollywood. Along the way, Kermit picks up Fozzie Bear, Miss Piggy, Gonzo, and a motley crew of other Muppets with similar aspirations. Meanwhile, Kermit must elude the grasp of a frog-leg restaurant magnate.",1.530709,/48Ve7uLDcPJFGaDnmYYdcV3Ve1M.jpg,1979-05-31,The Muppet Movie,False,7.01,81,Kermit the Frog / Rowlf / Dr. Teeth / Waldorf / Doc Hopper's Men / Link Hogthrob / Swedish Chef (voice),Miss Piggy / Fozzie Bear / Animal / Sam the Eagle / Doc Hopper's Men / Marvin Suggs (uncredited) / Swedish Chef (hands) (uncredited) / Motorcycle Guy (uncredited) (voice),Floyd Pepper / Robin the Frog / Crazy Harry / Lew Zealand / Camilla / Dr. Bunsen Honeydew (assistant) (uncredited) (voice)
269,False,/gCz20Q91KFTM78Sskd5fj6IC2na.jpg,[35],6471,en,The Jerk,"After discovering he's not really black like the rest of his family, likable dimwit Navin Johnson runs off on a hilarious misadventure in this comedy classic that takes him from rags to riches and back to rags again. The slaphappy jerk strikes it rich, but life in the fast lane isn't all it's cracked up to be and, in the end, all that really matters to Johnson is his true love.",2.156302,/wb6mB6R9vscPhyAegbbNDFZUAIs.jpg,1979-12-14,The Jerk,False,7.0,121,Navin R. Johnson,Marie Kimble Johnson,Patty Bernstein
270,False,/y3Z8Kf9sIRkKhXGalVIRLZGlS4i.jpg,"[18, 35, 37, 10749]",11145,en,The Electric Horseman,"Sonny Steele used to be a rodeo star, but his next appearance is to be on a Las Vegas stage, wearing a suit covered in lights, advertising a breakfast cereal. When he finds out they are going drug the horse in case its too frisky, he rides off into the desert...",1.314271,/zB9nhwFrBoIV0XtzBaL44h61Nrq.jpg,1979-12-21,The Electric Horseman,False,4.77,11,Norman 'Sonny' Steele,Alice 'Hallie' Martin,Charlotta Steele
271,False,/a2xUCgwOqI6QB7hxg7xiXCHhWMP.jpg,"[27, 878]",31915,en,Prophecy,"A Savage beast, grown to monstrous size and driven mad by toxic wastes that are poisoning the waters, spreads terror and death on a Maine countryside.",1.581804,/g4CtQPVbxOCRWmGYsZV7GntK5o7.jpg,1979-01-01,Prophecy,False,6.0,4,Maggie Verne,Dr. Robert Verne,John Hawks
272,False,/glzMRaDf6aBEwNkkR9Z0jmrYYbW.jpg,"[53, 18]",988,en,The China Syndrome,"While doing a series of reports on alternative energy sources, an opportunistic reporter Kimberly Wells witnesses an accident at a nuclear power plant. Wells is determined to publicise the incident but soon finds herself entangled in a sinister conspiracy to keep the full impact of the incident a secret.",1.638413,/u0tbxqq0krtGMWnuycmikHPQ22Z.jpg,1979-03-16,The China Syndrome,False,6.04,34,Kimberly Wells,Jack Godell,Richard Adams
273,False,/uWcP8K18A2VQZPgIztoP0P3zDzk.jpg,"[10749, 35, 27]",18966,en,Love at First Bite,"Dracula and Renefield relocate to 70's era New York in search of Cindy Sondheim (the reincarnation of Dracula's one true love, Mina Harker). ""Trouble adjusting"" is a wild understatement for the Count as he battles Cindy's psychiatrist, Jeffrey Rosenberg (a descendant of Van Helsing who changed his name for professional reasons?), who may almost certainly, possibly, may be in love with Cindy too.",1.123704,/yb4uCXp9MmoVYLECk8J0FA5WETz.jpg,1979-04-27,Love at First Bite,False,5.96,13,Count Vladimir Dracula,Cindy Sondheim,Dr. Jeffery Rosenberg / Van Helsing
274,False,/doJGjcWPpuGuDPJwCpCNnYUG9x4.jpg,"[80, 18, 36]",10734,en,Escape from Alcatraz,"The true story of three inmates who attempt a daring escape from the infamous prison, Alcatraz Island. Although no-one had managed to escape before, bank robber Frank Morris masterminded this elaborately detailed and, as far as anyone knows, ultimately successful, escape. In 29 years, this seemingly impenetrable federal penitentiary, which housed Al Capone and ""Birdman"" Robert Stroud, was only broken once by three inmates never heard of again.",3.137356,/lBAxIEywz3KfzXimn9qHBArLHU8.jpg,1979-06-22,Escape from Alcatraz,False,7.09,249,Frank Morris,Warden,Doc
275,False,/7OzHKga2gEj37QIsA86rcbr8PGf.jpg,"[35, 18, 10749]",696,en,Manhattan,The life of a divorced television writer dating a teenage girl is further complicated when he falls in love with his best friend's mistress.,2.438291,/2OmmKrcLfFQeTd5N7pZeAw6fJPA.jpg,1979-04-25,Manhattan,False,7.62,283,Isaac Davis,Mary Wilkie,Yale
276,False,/jcQdwJqP7UB4Kf98iZIQ6lMtYJH.jpg,"[18, 10402]",16858,en,All That Jazz,"Bob Fosse's semi-autobiographical film celebrates show business stripped of glitz or giddy illusions. Joe Gideon (Roy Scheider) is at the top of the heap, one of the most successful directors and choreographers in musical theatre. But he can feel his world slowly collapsing around him--his obsession with work has almost destroyed his personal life, and only his bottles of pills keep him going.",1.505255,/x4ppWRGH3pfVmEsbNC8UhvZVswd.jpg,1979-12-20,All That Jazz,False,6.9,39,Joe Gideon,Angelique,Audrey Paris
277,False,/UukOK9wZGGrKWgh1ORNgxvTXpN.jpg,"[12, 10751]",17264,en,The Black Stallion,"While traveling with his father, young Alec becomes fascinated by a mysterious Arabian stallion that is brought on board and stabled in the ship he is sailing on. When it tragically sinks both he and the horse survive only to be stranded on a deserted island. He befriends it, so when finally rescued both return to his home where they soon meet Henry Dailey, a once successful trainer. Together they begin training the horse to race against the fastest ones in the world.",2.411736,/ffwGAYlVaGpsEEuchZu84rhScQO.jpg,1979-10-17,The Black Stallion,False,6.73,26,Alec Ramsey,Henry Dailey,Alec's Mother
278,False,/fTffSYoqcxskecnIMX9YJSvmilA.jpg,"[12, 10751, 878, 28]",9570,en,The Black Hole,"The explorer craft U.S.S. Palomino is returning to Earth after a fruitless 18-month search for extra-terrestrial life when the crew comes upon a supposedly lost ship, the magnificent U.S.S. Cygnus, hovering near a black hole. The ship is controlled by Dr. Hans Reinhardt and his monstrous robot companion, Maximillian. But the initial wonderment and awe the Palomino crew feel for the ship and its resistance to the power of the black hole turn to horror as they uncover Reinhardt's plans.",2.699403,/20IPuZOXNRZJBN0loUYClFR8cpx.jpg,1979-12-18,The Black Hole,False,5.65,49,Dr. Hans Reinhardt,Dr. Alex Durant,Capt. Dan Holland
279,False,/j3FcOV6Ss3DYS8S170R2O6dHB3J.jpg,"[80, 18, 9648, 53]",17443,en,...And Justice for All,"An ethical Baltimore defense lawyer disgusted with rampant legal corruption is asked to defend a judge he despises in a rape trial. But if he doesn't do it, the judge will have him disbarred.",1.814141,/xiMZwW8GJiJteLZttRwxVi7oFet.jpg,1979-10-19,...And Justice for All,False,6.55,44,Arthur Kirkland,Judge Francis Rayford,Judge Henry T. Fleming
280,False,/AkE7LQs2hPMG5tpWYcum847Knre.jpg,"[12, 28, 878]",1891,en,The Empire Strikes Back,"The epic saga continues as Luke Skywalker, in hopes of defeating the evil Galactic Empire, learns the ways of the Jedi from aging master Yoda. But Darth Vader is more determined than ever to capture Luke. Meanwhile, rebel leader Princess Leia, cocky Han Solo, Chewbacca, and droids C-3PO and R2-D2 are thrown into various stages of capture, betrayal and despair.",3.568327,/6u1fYtxG5eqjhtCPDx04pJphQRW.jpg,1980-01-01,The Empire Strikes Back,False,8.01,3715,Luke Skywalker,Han Solo,Princess Leia
281,False,/qugcFtH0nsG6vfLFOzxNhPpuezV.jpg,"[10402, 35, 28, 80]",525,en,The Blues Brothers,"Direct out of jail, Jake Blues and his Brother Elwood are off on a “mission from God” to raise funds for the orphanage in which they grew up. The only thing they can do is do what they do best: play music. So they get their old band together and they're on their way yet not without getting in a bit of trouble here and there.",2.776124,/6hesUNBkpVRqBTBw2HlTg0h8b56.jpg,1980-06-17,The Blues Brothers,False,7.22,571,Elwood Blues (as Elwood),'Joliet' Jake Blues (as Jake),Reverend Cleophus James
282,False,/1d0bPDy0Ud7g7vZ5qnKI6HsduLE.jpg,"[28, 12, 14, 878]",8536,en,Superman II,"Three escaped criminals from the planet Krypton test the Man of Steel's mettle. Led by Gen. Zod, the Kryptonians take control of the White House and partner with Lex Luthor to destroy Superman and rule the world. But Superman, who attempts to make himself human in order to get closer to Lois, realizes he has a responsibility to save the planet.",2.666149,/uvxjXSfph2FD07A2jBG9NHJnl27.jpg,1980-12-04,Superman II,False,6.21,297,Lex Luthor,Superman / Clark Kent,Otis
283,False,/xRzfPXPDMSEgZ2xbLZwBSk20HZN.jpg,[35],21629,en,Stir Crazy,"New Yorkers, Skip Donahue and Harry Monroe, have no jobs and no prospects. They decide to flee the city and find work elsewhere, and land jobs as woodpeckers to promote the opening of a bank. When their feathery costumes are stolen and used in a bank robbery, they no longer have to worry about employment -- they're sent to prison!",2.496991,/shVqz52HLJrtTynY7xlkSTFBNDv.jpg,1980-12-12,Stir Crazy,False,6.68,57,Skip Donahue,Harry Monroe,Rory Schultebrand
284,False,/tFPvOmz0uNmfp1sq2ebYAeUCLQ4.jpg,"[35, 10749]",813,en,Airplane!,"Still craving for the love of his life, ex-Air Force pilot Ted Striker follows Elaine onto the flight that she is working on as cabin crew. Elaine doesn't want to be with Ted anymore, but when the crew and passengers fall ill from food poisoning, Ted might be the only one who can save them.",2.477204,/b4sAWNIbfXw4WTdc1wiVRBk2Vko.jpg,1980-07-02,Airplane!,False,6.95,575,Ted Striker,Elaine,Murdock
285,False,/pq5pTzVCj6jdnV9E6PXrBdXpKVb.jpg,"[28, 12, 35]",17169,en,Any Which Way You Can,"Philo takes part in a bare knuckle fight - as he does - to make some more money than he can earn from his car repair business. He decides to retire from fighting, but when the Mafia come along and arrange another fight, he is pushed into it. A motorcycle gang and an orangutan called Clyde all add to the 'fun'.",1.577485,/pd2wLrnIbPYSTeLERTsLpCAmRUn.jpg,1980-12-17,Any Which Way You Can,False,5.83,39,Philo Beddoe,Lynn Halsey-Taylor,Orville Boggs
286,False,/CrWYIQepyzqnehP4xn5F3AF1JA.jpg,"[28, 35]",12705,en,Smokey and the Bandit II,"The Bandit goes on another cross-country run, transporting an elephant from Florida to Texas. And, once again, Sheriff Buford T. Justice is on his tail.",2.120462,/25YqvxJlkXBO9AumXzrVlruEKwX.jpg,1980-08-15,Smokey and the Bandit II,False,5.04,39,'Bandit',Sheriff Buford T. Justice,Cledus Snow
287,False,/d1DyIWgc80ufW2ENGOMNZRbpq4x.jpg,[27],4488,en,Friday the 13th,Camp counselors are stalked and murdered by an unknown assailant while trying to reopen a summer camp that was the site of a child's drowning.,2.771185,/mGJlh8oMyTDhfudvs20kFpYz0Yc.jpg,1980-05-09,Friday the 13th,False,6.43,269,Mrs. Voorhees,Alice,Bill
288,False,/3x59nJ0umJAh0NWk9F8heCJt9nk.jpg,"[10749, 12, 18]",5689,en,The Blue Lagoon,"Two small children and a ship's cook survive a shipwreck and find safety on an idyllic tropical island. Soon, however, the cook dies and the young boy and girl are left on their own. Days become years and Emmeline (Brooke Shields) and Richard (Christopher Atkins) make a home for themselves surrounded by exotic creatures and nature's beauty. But will they ever see civilization again?",2.579134,/6zmAK0Ormo2xQh0K4FYPAnsKYc0.jpg,1980-07-05,The Blue Lagoon,False,5.79,156,Emmeline,Richard,Paddy Button
289,False,/h4DcDCOkQBENWBJZjNlPv3adQfM.jpg,"[27, 53]",694,en,The Shining,"Jack Torrance accepts a caretaker job at the Overlook Hotel, where he, along with his wife Wendy and their son Danny, must live isolated from the rest of the world for the winter. But they aren't prepared for the madness that lurks within.",4.88948,/9fgh3Ns1iRzlQNYuJyK0ARQZU7w.jpg,1980-05-22,The Shining,False,7.85,1745,Jack Torrance,Wendy Torrance,Danny Torrance
290,False,/1roA2YzGEUaRYvoMf8bvwT3Isl4.jpg,"[28, 12, 35]",13612,en,Cheech & Chong's Next Movie,"Perennially stoned Cheech and Chong tear through the city of Los Angeles, causing trouble wherever they go. After Cheech loses his job, the two pot enthusiasts head to the welfare offices where Cheech's girlfriend, Donna, works. Instead of collecting unemployment, they find themselves thrown back on the streets, searching for a way to earn new income. But when Cheech's cousin, ""Red"" Mendoza, arrives, things get even crazier.",2.226109,/tHQidVxMZNV32rbOWGsK83pL2m.jpg,1980-07-18,Cheech & Chong's Next Movie,False,6.34,22,Cheech,Chong,Donna
291,False,/kdL7CWq5msNd2CzE11fNkY0k4m7.jpg,[35],11977,en,Caddyshack,"At an exclusive country club, an ambitious young caddy, Danny Noonan, eagerly pursues a caddy scholarship in hopes of attending college and, in turn, avoiding a job at the lumber yard. In order to succeed, he must first win the favour of the elitist Judge Smails, and then the caddy golf tournament which Smails sponsors.",1.827746,/tv6s71pj8mhHtfk6DaSxMlu9pd7.jpg,1980-07-25,Caddyshack,False,6.45,181,Ty Webb,Al Czervik,Richter Elihu Smails
292,False,/9LoUUwgApyMRTmrcMWxUAlM91nf.jpg,"[80, 18]",1623,en,Brubaker,The new warden of a small prison farm in Arkansas tries to clean it up of corruption after initially posing as an inmate.,1.693139,/d7LtL56gLMnrpXPvdyYvybsvlMo.jpg,1980-06-20,Brubaker,False,6.93,36,Henry Brubaker,Richard 'Dickie' Coombes,Lillian Gray
293,False,/kngjkJc8DZbbxxLzC9D139l4Z63.jpg,"[27, 9648, 53]",11033,en,Dressed to Kill,"A mysterious, tall, blonde woman, wearing sunglasses murders one of a psychiatrist's patients, and now she's after the prostitute who witnessed it.",2.246157,/b9RHUexTE6MT5x6iZ2Wmq56H1cJ.jpg,1980-06-25,Dressed to Kill,False,6.79,59,Doctor Robert Elliott,Kate Miller,Liz Blake
294,False,/bOVyJyl19wX6crzZDCERXeweeZ8.jpg,[878],3604,en,Flash Gordon,"A football player and his friends travel to the planet Mongo and find themselves fighting the tyrant, Ming the Merciless, to save Earth.",2.237524,/9c5vKUX7MB1yixVp0ZFAUDRTaeE.jpg,1980-09-01,Flash Gordon,False,5.72,87,Flash Gordon,Dale Arden,Kaiser Ming
295,False,/rR479zn26lJp4vNxXKjfBVCHLAW.jpg,"[18, 36]",1955,en,The Elephant Man,"A Victorian surgeon rescues a heavily disfigured man being mistreated by his ""owner"" as a side-show freak. Behind his monstrous facade, there is revealed a person of great intelligence and sensitivity. Based on the true story  of Joseph Merrick (called John Merrick in the film), a severely deformed man in 19th century London.",2.492018,/lDXJUmLQsViSKLbil2luD91l2kE.jpg,1980-10-03,The Elephant Man,False,7.59,303,Dr. Frederick Treves,John Merrick,Mrs. Kendal
296,False,/xXDGjVn3cdNG11FbHufsHDFPJG8.jpg,[18],1578,en,Raging Bull,"When Jake LaMotta steps into a boxing ring and obliterates his opponent, he's a prizefighter. But when he treats his family and friends the same way, he's a ticking time bomb, ready to go off at any moment. Though LaMotta wants his family's love, something always seems to come between them. Perhaps it's his violent bouts of paranoia and jealousy. This kind of rage helped make him a champ, but in real life, he winds up in the ring alone.",2.672721,/3cgzzWsUOBlNjmA5m4qs9BGkezC.jpg,1980-11-14,Raging Bull,False,7.44,408,Jake La Motta,Joey La Motta,Vickie Thailer
297,False,/s5rs0TzqYhlmzJmWbapyveCspYr.jpg,"[53, 18, 80, 10749]",2768,en,American Gigolo,"Julian makes a lucrative living as an escort to older women in the Los Angeles area. He begins a relationship with Michelle, a local politician's wife, without expecting any pay. One of his clients is murdered and Detective Sunday begins pumping him for details on his different clients, something he is reluctant to do considering the nature of his work. Julian begins to suspect he's being framed. Meanwhile Michelle begins to fall in love with him.",1.320555,/kwbOIABYZjLwd8UViMvkw40l2rr.jpg,1980-02-08,American Gigolo,False,5.81,50,Julian Kaye,Michelle Stratton,Cloak Room Girl
298,False,/eH7OqA7uQAFAY66lsX55XWHBSOM.jpg,"[18, 10751]",21873,en,My Bodyguard,"Clifford Peach (Chris Makepeace), an easygoing teenager, is finding less than easy to fit in at his new high school, where a tough-talking bully (Matt Dillon) terrorizes his classmates and extorts their lunch money. Refusing to pay up, Clifford enlist the aid of an overgrown misfit whose mere presence intimidates students and teachers alike. But their ""business relationship"" soon turns personal as Clifford and the troubled loner forge a winning alliance against their intimidators - and a very special friendship with each other. Ruth Gordon, Martin Mull, Joan Cusack and John Houseman round out ""a truly remarkable cast"" (Variety) in this delightful coming-of-age comedy and triumphant tribute to the underdog.",1.586503,/v0AgK10BeuLloxTiXLWYFZ6DmWN.jpg,1980-07-11,My Bodyguard,False,5.93,14,Clifford Peache,Ricky Linderman,Melvin Moody
299,False,/la2eNbJn617ncYQhMQqxFiduC06.jpg,"[14, 10402, 10749]",15668,en,Xanadu,A beautiful muse inspires an artist and his older friend to convert a dilapidated auditorium into a lavish rollerskating club.,1.108018,/wc3dC8DrI6qgD5sQlIkbjU7wcaS.jpg,1980-08-08,Xanadu,False,5.24,29,Kira,Danny McGuire,Sonny Malone
300,False,/dU1CArBM4YsKLfG8YvhtuTJJaGR.jpg,"[12, 28]",85,en,Raiders of the Lost Ark,"When Dr. Indiana Jones – the tweed-suited professor who just happens to be a celebrated archaeologist – is hired by the government to locate the legendary Ark of the Covenant, he finds himself up against the entire Nazi regime.",3.763573,/44sKJOGP3fTm4QXBcIuqu0RkdP7.jpg,1981-06-12,Raiders of the Lost Ark,False,7.44,2403,Indiana Jones,Marion Ravenwood,Dr. Rene Belloq
301,False,/hg8ecg8LrR8ChvZh4aMETNUraGA.jpg,"[12, 28, 53]",699,en,For Your Eyes Only,A British spy ship has sunk and on board was a hi-tech encryption device. James Bond is sent to find the device that holds British launching instructions before the enemy Soviets get to it first.,3.394204,/vpZZZ2eq8z4I6PSeGxR2UWNciGG.jpg,1981-06-23,For Your Eyes Only,False,5.91,250,James Bond,Melina Havelock,Milos Columbo
302,False,/nv6Ur5vvcPrlqUlWJt3qPclNWCH.jpg,[35],10246,en,Porky's,"Set in 1954, a group of Florida high schoolers seek out to lose their virginity which leads them to seek revenge on a sleazy nightclub owner and his redneck sheriff brother for harassing them.",1.979805,/yfwbpCll3RBxJmixrZvpc2NaqQY.jpg,1981-11-13,Porky's,False,5.98,72,Pee Wee,Billy,Tommy
303,False,/7i4A8qR3oZX9Ajdaf0IsZAhvtr8.jpg,"[35, 18, 10749]",13665,en,Arthur,"Arthur is the most quotable drunk millionaire that is likely to ever steal your heart. Dudley Moore portrays Arthur, a thirty year old child who will inherit 750 million dollars if he complies with his family's demands and marries the woman of their choosing.",1.555845,/jddxGVvDxhcnnRphdI2krUGYw6O.jpg,1981-07-17,Arthur,False,6.35,43,Arthur Bach,Linda Marolla,Hobson
304,False,/thGE7y795wcw7I6bEJbbreO6uLQ.jpg,"[28, 35]",10890,en,Stripes,"John Winger, an indolent sad sack in his 30s, impulsively joins the U.S. Army after losing his job, his girlfriend and his apartment.",2.122978,/3qYaYMHdzDfNN8nJ6SKnMbP5rDN.jpg,1981-06-25,Stripes,False,6.45,98,John Winger,Russell Ziskey,Sgt. Hulka
305,False,/mc0PbKrrFRCUEpI09reR3ihHrIo.jpg,"[28, 18, 36, 10752, 12]",387,de,Das Boot,"A German submarine hunts allied ships during the Second World War. Soon it becomes hunted itself. The crew tries to survive below the surface, while stretching both the boat and themselves to their limits...",2.88279,/kI1rptTkqDWj6SBRsYwguBvPViT.jpg,1981-09-16,Das Boot,False,7.69,336,Kapitän-Leutnant Heinrich Lehmann-Willenbrock,Leutnant Werner,Der Leitende/Fritz Grade
306,False,/4jGa1eKlByq8rAknmUpgYUcdkgn.jpg,[35],11286,en,The Cannonball Run,"A cross-country road race is based on an actual event, the Cannonball Baker Sea to Shining Sea Memorial Trophy Dash, organized by Brock Yates to protest the 55 mph speed limit then in effect in the U.S. The Cannonball was named for Erwin G. ""Cannonball"" Baker, who in the roaring 20's rode his motorcycle across the country. Many of the characters are based on ruses developed by real Cannonball racers over the several years that the event was run.",1.909834,/5OkKXKDtZDDJADWu88wQa1nynsQ.jpg,1981-06-19,The Cannonball Run,False,6.33,63,J.J. McClure,"Seymour Goldfarb, Jr.",Pamela Glover
307,False,/dAAP1FCksIfAdqarHL5cToLZlAi.jpg,"[18, 36]",9443,en,Chariots of Fire,"Based on the true story of British athletes preparing for and competing in the 1924 Summer Olympics. The film was nominated for seven Academy Awards and won four, including Best Picture.",2.182913,/fIOIKIUNaQZyIgcDSsEYFyLxAh1.jpg,1981-05-15,Chariots of Fire,False,6.6,88,Harold Abrahams,Eric Liddell,Jennie Liddell
308,False,/zkRUqOtYfjLyXo0aJsrnRq0fSOf.jpg,"[12, 18, 28]",62204,xx,La Guerre du feu,"A colossal adventure odyssey that turns back the hands of time to the very beginning of man's existence. 80,000 years ago, when man roamed the earth, he was exposed to the many harsh elements of nature. Against the perilous atmosphere of rugged terrain, rival tribes and savage beasts, Quest for Fire examines a peaceful tribe's search for that all important element fire, and the knowledge to create it. Focusing on human dream as well as realistic insights into pre-historic man, the constant struggle for survival is vividly recreated in this sensational production.",2.224013,/p81jT5YVj0zNZiQoDe9eBZvw5Rc.jpg,1981-12-15,Quest for Fire,False,6.64,44,Naoh,Amoukar,Gaw
309,False,/iSi3OJKSPNknaxSvjpOa6c38Xgn.jpg,"[878, 28]",1103,en,Escape from New York,"In 1997, the island of Manhattan has been walled off and turned into a giant maximum security prison within which the country's worst criminals are left to form their own anarchic society. However, when the President of the United States crash lands on the island, the authorities turn to a former soldier and current convict, Snake Plissken, to rescue him.",3.331328,/z1KTbKJh7vSTTXllxxE4DWG63rT.jpg,1981-06-24,Escape from New York,False,6.52,315,Snake Plissken,Police Commissioner Bob Hauk,Cabbie
310,False,/zTB8FzT5llI39Tvo0wEk2XWbCLY.jpg,"[10751, 14, 878, 12, 35]",36819,en,Time Bandits,"In Terry Gilliam's fantastic voyage through time and space, a boy escapes from his gadget-obsessed parents to join a band of time-traveling dwarves. On their journey, they visit Napoleon (Ian Holm), Robin Hood (John Cleese) and King Agamemnon (Sean Connery), among other popular figures. It's a giddy, visually outrageous fairy tale, a revisionist history lesson and a satire on technology gone awry -- all wrapped into one adventure.",2.500458,/ydI0Z7JWTaDLg8uJEddpzy4UBcl.jpg,1981-07-13,Time Bandits,False,6.18,106,Robin Hood,King Agamemnon / Fireman,Dame Pansy / Pansy
311,False,/ipA9SO13E6ha5nL2qSb8RPc38rq.jpg,"[12, 14, 10751]",10323,en,Clash of the Titans,"To win the right to marry his love, the beautiful princess Andromeda, and fulfil his destiny, Perseus must complete various tasks including taming Pegasus, capturing Medusa's head, and battling the Kraken monster.",1.913225,/75OBW467vx8ceJMSRK4NhOXk5Rc.jpg,1981-03-15,Clash of the Titans,False,6.67,92,Zeus,Hera,Thetis
312,False,/g2cGub9eRfaSmM8vvVuQqyvWCpv.jpg,"[18, 10749, 53]",19429,en,Absence of Malice,"A prosecutor leaks a false story that liquor warehouse owner Michael Gallagher is involved in the murder of a union head, and as newspaper reporter Megan Carter picks up the story and attempts to find the real truth, Gallagher's life begins to unravel.",1.47574,/AuxBNTIo86c7DhM68947wadUkrG.jpg,1981-12-18,Absence of Malice,False,6.79,14,Michael Colin Gallagher,Megan Carter,Rosen
