,adult,backdrop_path,genre_ids,id,original_language,original_title,overview,popularity,poster_path,release_date,title,video,vote_average,vote_count,character0,character1,character2
0,False,/8N14q1XanN3LN8ahGYsrhS0NQFQ.jpg,"[18, 12, 10749]",14689,en,Hawaii,"Abner Hale, a rigid and humorless New England missionary, marries the beautiful Jerusha Bromley and takes her to the exotic island kingdom of Hawaii, intent on converting the natives. But the clash between the two cultures is too great and instead of understanding there comes tragedy.",1.395569,/10AVx4V6zVszw75VGC0VCvVfRe4.jpg,1966-10-10,Hawaii,False,4.57,7,Jerusha Bromley,Rev. Abner Hale,Capt. Rafer Hoxworth
1,False,/u7unQwnv8olv8EofKFlhxlUakOJ.jpg,[18],396,en,Who's Afraid of Virginia Woolf?,Mike Nichols’ film from Edward Albee's play brought new themes to the film industry. Elizabeth Taylor and Richard Burton have never been more brilliant together as they portray an experienced married couple who love each other yet verbally attack one another when they see how boring their naïve newlywed guests have made their night.,1.788096,/qBiQzPZgr4dSgw9VdgR9o5UjHB1.jpg,1966-06-21,Who's Afraid of Virginia Woolf?,False,7.42,66,Martha,George,Nick
2,False,/vOddAD7yWumFnQISLwFNyjHJ3EP.jpg,"[28, 12, 18, 10752, 10749]",5923,en,The Sand Pebbles,"Engineer Jake Holman arrives aboard the gunboat U.S.S. San Pablo, assigned to patrol a tributary of the Yangtze in the middle of exploited and revolution-torn 1926 China. His iconoclasm and cynical nature soon clash with the ""rice-bowl"" system which runs the ship and the uneasy symbiosis between Chinese and foreigner on the river. Hostility towards the gunboat's presence reaches a climax when the boat must crash through a river-boom and rescue missionaries upriver at China Light Mission.",1.355208,/1X1d30OaJE87iqCGjNaNCeRUP7R.jpg,1966-12-20,The Sand Pebbles,False,6.92,24,Jake Holman,Frenchy Burgoyne,Captain Collins
3,False,/96JE9fN60EjjvfLiUwaOPNOw9zn.jpg,"[28, 35, 53]",21779,en,The Silencers,"Matt Helm (Dean Martin) is called out of retirement to stop the evil Big O organization who plan to explode an atomic bomb over Alamagordo, NM, and start WW III.",1.154493,/4B1z2rhVLLU2VKFFZfRsJVfrnHt.jpg,1966-02-18,The Silencers,False,5.58,6,Matt Helm,Gail,Tina
4,False,/w4t3YpCg2tGzOmbWQBVjyhDK9iN.jpg,"[9648, 53]",5780,en,Torn Curtain,An American scientist publicly defects to East Germany as part of a cloak and dagger mission to find the solution for a formula resin and then figuring out a plan to escape back to the West.,2.309785,/1sza0VpdnBkIvOhkDu9kdsRUTg3.jpg,1966-07-13,Torn Curtain,False,6.28,44,Michael Armstrong,Sarah Sherman,Countess Kuchinska
5,False,/mzoj3fsvm7HbP8m8YatFqqXjepZ.jpg,"[12, 878]",2161,en,Fantastic Voyage,"The science of miniaturization has been unlocked, and the army has big plans. But when a scientist carrying the secret of the process is injured in a surprise attack, a life-threatening blood clot puts him into a coma. Now, a team of adventurers will have to use the technology to travel inside his body and destroy the clot.",1.699309,/hZRYghurxiVXzkSe0JLtfIaOwM0.jpg,1966-08-24,Fantastic Voyage,False,6.63,38,Grant,Cora,Gen. Carter
6,False,/xGC2fY5KFmtuXnsuQwYQKFOLZFy.jpg,[37],429,it,"Il buono, il brutto, il cattivo","While the Civil War rages between the Union and the Confederacy, three men – a quiet loner, a ruthless hit man and a Mexican bandit – comb the American Southwest in search of a strongbox containing $200,000 in stolen gold.",3.465483,/wfPHdfofBD5PN96dV96a51B3Ja2.jpg,1966-12-23,"The Good, the Bad and the Ugly",False,7.82,1401,Tuco,Blondin,Sentenza/Angel Eyes
7,False,/1PODaFULjnsbkgirmFfm9i0cJB1.jpg,"[28, 37]",6644,en,El Dorado,"Cole Thornton, a gunfighter for hire, joins forces with an old friend, Sheriff J.P. Hara. Together with an old indian fighter and a gambler, they help a rancher and his family fight a rival rancher that is trying to steal their water.",1.765849,/jnbUOe6dAXK4Hs6dhYgvmdr5CbO.jpg,1966-12-17,El Dorado,False,7.16,34,Cole Thornton,Sheriff J.P. Harrah,Mississippi
8,False,/86A7oAiaUGyWKHUzOevmftkGf5.jpg,"[12, 35]",23832,it,L'armata Brancaleone,"A group of rogues steal a scroll granting its bearer the property of the land of Aurocastro in Apulia (south of Italy). They elect a shaggy knight, Brancaleone from Norcia, as their leader, and decide to get possession of this supposedly wealthy land. Many adventures will occurr during the journey.",1.057373,/qe3UJj6MuTNmJh65hd9NPis8ViT.jpg,1966-04-07,For Love and Gold,False,5.88,12,Brancaleone da Norcia,Teofilatto dei Leonzi,Matelda
9,False,/j9TWVrd0BHUfk9AuSFnchgexY0A.jpg,"[18, 10752, 36]",17295,it,La battaglia di Algeri,Tracing the struggle of the Algerian Front de Liberation Nationale to gain freedom from French colonial rule as seen through the eyes of Ali from his start as a petty thief to his rise to prominence in the organisation and capture by the French in 1957. The film traces the rebels' struggle and the increasingly extreme measures taken by the French government to quell the revolt.,1.988648,/6Kv3n1cgiEAEYF4wepECk1OeH7N.jpg,1966-09-08,The Battle of Algiers,False,7.38,75,Ali La Pointe,Col. Mathieu,Djafar
10,False,,"[16, 99, 10751, 14]",289179,en,How the Grinch Stole Christmas!: Documentary,"The Making of the story of how A grumpy hermit hatches a plan to steal Christmas from the Whos of Whoville.  You're A Mean One, Mr. Grinch.  Bitter and hateful, the Grinch is irritated at the thought of the nearby village having a happy time celebrating Christmas. So disguised as Santa Claus, with his dog made to look like a reindeer, he raids the village to steal all the Christmas things. The village is sure to have a sad Christmas this year.",1.000387,/1hmUmJiu8ioBvF9mq4g1OQzNZSA.jpg,1966-01-01,How the Grinch Stole Christmas! Documentary,False,0.0,0,,Commentator,Comentator 2
11,False,/czwpcXwUVGo7GKx85KF6MgqmOrX.jpg,[18],20108,fr,Au hasard Balthazar,"The sad life and death of Balthazar, a donkey, from an idyllic childhood surrounded by loving children, through adulthood as a downtrodden beast of burden. His life is paralleled with that of the girl who named him, and as she is humiliated by her sadistic lover, so he is beaten by his owner. But he finds a kind of peace when he is employed by an old miller who thinks he is a reincarnated saint.",1.331289,/wGpLTTOHJXlnbArj3X4ZCWF64c5.jpg,1966-05-25,Au hasard Balthazar,False,6.92,30,Marie,Jacques,Gérard
12,False,/G2xoqLeafIpXByTfw9qucM6E20.jpg,"[28, 37]",10772,it,Django,"Django is a 1966 Italian spaghetti Western film directed by Sergio Corbucci and starring Franco Nero in the eponymous role. The film earned a reputation as being one of the most violent films ever made up to that point and was subsequently refused a certificate in Britain until 1993, when it was eventually issued an 18 certificate. Subsequent to this the film was downgraded to a 15 certificate in 2004. Although the name is referenced in over thirty ""sequels"" from the time of the film's release until the mid 1980s in an effort to capitalize on the success of the original, none of these films were official, featuring neither Corbucci nor Nero. Nero did reprise his role as Django in 1987's Django 2: Il Grande Ritorno (Django Strikes Again), in the only official sequel to be written by Corbucci.",2.172387,/7YCMQ6ybiSv67EJJ1cb2Q1WKX4T.jpg,1966-04-05,Django,False,6.81,67,Django,Gen. Hugo Rodriguez,Maria
13,False,/azU9CYPwYrP5VXUCaFPpMpZxrQY.jpg,[],1686,en,Chelsea Girls,"Lacking a formal narrative, Warhol's art house classic follows various residents of the Chelsea Hotel in 1966 New York City, presented in a split screen with a single audio track in conjunction with one side of screen.",1.01823,/bTyALg0Ko7GfwEH2ZiDUr4cJqc.jpg,1966-09-15,Chelsea Girls,False,4.0,1,,Brigid Berlin - The Duchess,Hanoi Hannah
14,False,/9DBa6qJgR7ACvXHK1C8HA3WsSH1.jpg,"[28, 12, 14]",3591,en,One Million Years B.C.,"As the Earth wrestles with its agonising birth, the peoples of this barren and desolate world struggle to survive. Driven by animal instinct they compete against the harsh conditions, their giant predators, and warring tribes. When two people from opposing clans fall in love, existing conventions are shattered forever as each tribe struggles for supremacy and Man embarks on his tortuous voyage of civilisation.",2.062826,/bcXo4fWv3jquSnu0VI8PA2cf1xe.jpg,1966-12-30,One Million Years B.C.,False,5.59,17,Loana,Tumak,Sakana
15,False,/aDpvLlTLl1nLYsFHuHEYE8pv5qO.jpg,"[18, 36]",4708,fr,Paris brûle-t-il?,"The title is Adolf Hitler's question to his chief of staff Alfred Jodl on the eve of the liberation of Paris (August 25): the military governor of Paris, General Dietrich von Choltitz, had been ordered to destroy Paris rather than let it fall undamaged into the hands of the Allies, but von Choltitz disobeyed.The film follows historical events as U.S. General Dwight D. Eisenhower, head of the Allied invasion, refuses to divert troops to liberate Paris. His hand is forced by the French military leader, Philippe Leclerc, and by a Resistance uprising in the city. Von Choltitz keeps details of the uprising from the German high command in an effort to save the city being destroyed in retaliation. The film follows his turmoil as a soldier and as the man who doesn't wish to be seen by history as the cause of a beautiful city's destruction.",1.496627,/qAxvJzBhlNikqMVKKlkiLJ3wuDy.jpg,1966-10-26,Is Paris Burning?,False,7.21,14,Von Choltitz,Konsul Nordling,Lt. Henri Karcher
16,False,/twSX9G9h3hJPuU9kBiLecQw2nsH.jpg,"[18, 10749]",4710,fr,Masculin féminin,"The film stars French New Wave icon Jean-Pierre Léaud as Paul, a romantic young idealist and literary lion-wannabe who chases budding pop star, Madeleine (Chantal Goya, a real life Yé-yé girl).",1.760019,/4O7rHIBEaKgBc0hY40qveukhSSl.jpg,1966-03-22,Masculin Féminin,False,7.52,34,Paul,Madeleine,Elisabeth
17,False,/AnpkCxfyL1Nst8P9akuBws6uwU8.jpg,[35],4733,fr,Le Jardinier d'Argenteuil,"Tulipe, is an old man who lives alone in an old railway carriage in the Argentueil region of Paris. His main passions are gardening and oil painting, but he also has a secret source of income. His godson discovers that Tulipe is actually a master forger, producing perfect copies of 10 franc notes. His godson’s girlfriend sees this as an opportunity to get very rich – but she must persuade Tulipe to forge 500 franc notes. Assuming Tulipe’s agreement, his godson and his girlfriend buy an expensive new car and luxury villa in provincial France – but there is a cruel turn of fate in store for them when Tulipe strikes up a friendship with a millionaire playboy.",1.029151,/iJ6bNoVTNQuZ4uKvtPgK2lE7P9e.jpg,1966-10-07,The Gardener of Argenteuil,False,0.0,0,Tulipe,Hilda,Noël
18,False,/isJBZPl1B7OXzD6nLVrrIOSZ5Lt.jpg,"[35, 18, 10769, 53]",4772,en,Cul-de-sac,"A wounded criminal and his dying partner take refuge at a beachfront castle. The owners of the castle, a meek Englishman and his willful French wife, are initially the unwilling hosts to the criminals. Quickly, however, the relationships between the criminal, the wife, and the Englishman begin to shift in humorous and bizarre fashion.",1.7176,/yWvGHvN0LzpYrP5QiVnhGpg1UA5.jpg,1966-02-01,Cul-de-sac,False,6.88,16,George,Teresa,Richard
19,False,/gHVYqkvCBjE4TcarMXbuKnYTQkT.jpg,"[10752, 18]",4781,fr,La guerre est finie,"A group of Spanish refugees try to organize protests from France. Their network is under constant threat by the police and some of them have recently been arrested. The main character (played by Yves Montand) dedicated his whole life to the battle but he feels forever estranged. He doesn't find his place nor in his adoptive country (France) nor in love.
 But this film is not about the story, it's all about style. Alain Resnais has an original approach in this film and this is the thing that makes this film worth watching.",1.063481,/2q13EWFpmSYOLgKBhDDnzpxeSbB.jpg,1966-05-10,The War Is Over,False,5.5,5,Diego Mora,Marianne,Nadine Sallanches
20,False,/5CL7hSrmxLBTmRZtm9Ha94p392b.jpg,"[12, 28, 35]",12208,en,Casino Royale,"Sir James Bond is called back out of retirement to stop SMERSH. In order to trick SMERSH, Bond thinks up the ultimate plan. That every agent will be named James Bond. One of the Bonds, whose real name is Evelyn Tremble is sent to take on Le Chiffre in a game of baccarat, but all the Bonds get more than they can handle, especially when the ultimate villain turns out to be Bonds nephew.",2.624566,/g5fBYuP5Wc4yle6eXsKY6HQsbw2.jpg,1967-04-13,Casino Royale,False,5.41,70,James Bond,Evelyn Tremble,Vesper Lynd
21,False,/c2rWPWDJU6tIEHB9mA0BEmXDkAS.jpg,"[10751, 16, 12]",9325,en,The Jungle Book,"The Jungle Book follows the ups and downs of the man-cub Mowgli as he makes his way back to the human village with wise panther Bagheera to escape ruthless tiger Shere Khan. Along the way, he meets unforgettable friends and foes including mad King Louie of the Apes, the hypnotic snake Kaa and the loveable, happy-go-lucky bear Baloo, who teaches Mowgli about true friendship.",5.077413,/1AreNcL9s24Qfghbzomy0IlzCFk.jpg,1967-10-18,The Jungle Book,False,6.95,860,Baloo (voice),Bagheera (voice),Brenin Louie (voice)
22,False,/jahBdYTAGMJaEove9l9hzYpDKJD.jpg,"[28, 53, 12]",667,en,You Only Live Twice,A mysterious space craft kidnaps a Russian and American space capsule and brings the world on the verge of another World War. James Bond investigates the case in Japan and meets with his archenemy Blofeld. The fifth film from the legendary James Bond series starring Sean Connery as the British super agent.,4.651191,/7dnsJZniZK1Hbc9mOFDYa5W0dHi.jpg,1967-06-12,You Only Live Twice,False,6.2,280,James Bond,Aki,Helga Brandt
23,False,/sEWKMIlgUCCb2n5mT0Mf71DRKLR.jpg,"[35, 18, 10749]",37247,en,The Graduate,"Recent college graduate Benjamin Braddock is seduced by the wife of his father's business partner, Mrs. Robinson. Benjamin soon finds himself falling in love with her daughter, Elaine, as the affair with Mrs. Robinson mother comes back to haunt him.",3.403884,/itdaGoyXKIAXRrHmchoMsGbwp2y.jpg,1967-12-21,The Graduate,False,7.41,394,Mrs. Robinson,Ben Braddock,Elaine Robinson
24,False,/3qLb72ccGmJaFyQ6WOLZDfUbMUu.jpg,"[35, 18, 10749]",1879,en,Guess Who's Coming to Dinner,Matt and Christina Drayton are a couple whose attitudes are challenged when their daughter brings home a fiancé who is black.,1.888427,/uToKjd4JgBHsTJ3LwUnKPMT3UAz.jpg,1967-12-11,Guess Who's Coming to Dinner,False,7.37,64,Matt Drayton,Dr. John Wade Prentice,Christina Drayton
25,False,/lQPMBJ1rm9Qk0cHd1C1lAbJcXJj.jpg,"[80, 18]",475,en,Bonnie and Clyde,Bonnie and Clyde is based on the true stories of the gangster pair Bonnie Parker and Clyde Barrow who in the 1930s began robbing banks in U.S. cities until they were eventually killed. The film is a major landmark in the aesthetic movement known as the New Hollywood.,2.71707,/isuVmlzVtJVUqySAmkjLB4kXdNm.jpg,1967-07-18,Bonnie and Clyde,False,7.57,139,Clyde Barrow,Bonnie Parker,C.W. Moss
26,False,/gXU3T3zEVaH8lkMNGjyA43K3lDj.jpg,"[10402, 18, 10749]",3055,en,Valley of the Dolls,Film version of Jacqueline Susann's best-selling novel chronicling the rise and fall of three young ladies in show business.,1.279698,/gbML7o2sCPzWa357JTqE3v7PwKy.jpg,1967-12-27,Valley of the Dolls,False,6.18,11,Anne Welles,Neely O'Hara,Jennifer North
27,False,/hJ6JHtIdFbwjp0IRNT7oUlweWst.jpg,"[28, 12, 10752]",1654,en,The Dirty Dozen,"Classic World War II action drama about a group of 12 American military prisoners, who are ordered to infiltrate a well-guarded enemy château and kill the Nazi officers vacationing there. The soldiers, most of whom are facing death sentences for a variety of violent crimes, agree to the mission and the possible commuting of their sentences.",1.585348,/5SawqeuARDbUPrFohTulwd2PZ2N.jpg,1967-06-15,The Dirty Dozen,False,7.15,162,Maj. John Reisman,Maj. Gen. Worden,Joseph Wladislaw
28,False,/3bgl4l4HZZS0hmXfqspooR7O06z.jpg,"[28, 18]",44695,en,The Born Losers,A ruthless motorcycle gang rides into a California town and terrorizes its denizens.,1.270833,/V4JqWfHypz0oheAK1wLBDX9yiQ.jpg,1967-08-18,The Born Losers,False,5.28,9,Billy Jack,Vicky Barrington,Daniel 'Danny' Carmody
29,False,/nXBR8MS7v8V1i0yjHrmpLieaKHe.jpg,"[80, 18, 9648, 53]",10633,en,In the Heat of the Night,An African American detective is asked to investigate a murder in a racist southern town.,2.518351,/cC3kyApHMNSfvsF67421L5IiTbc.jpg,1967-08-02,In the Heat of the Night,False,6.91,77,Det. Virgil Tibbs,Police Chief Bill Gillespie,Off. Sam Wood
30,False,/97oVyyXriXlwIaiDDvB0p72471o.jpg,"[80, 18]",903,en,Cool Hand Luke,"When petty criminal Luke Jackson is sentenced to two years in a Florida prison farm, he doesn't play by the rules of either the sadistic warden or the yard's resident heavy, Dragline, who ends up admiring the new guy's unbreakable will. Luke's bravado, even in the face of repeated stints in the prison's dreaded solitary confinement cell, ""the box,"" make him a rebel hero to his fellow convicts and a thorn in the side of the prison officers.",2.693268,/vDwphkloD7ToaDpKASAXGgHOclN.jpg,1967-06-22,Cool Hand Luke,False,7.14,157,Luke Jackson,Dragline,Boss Paul
31,False,/vXYcUDIPZCfEyglzCvGdB63ATHR.jpg,"[80, 18, 53]",11206,en,Wait Until Dark,"After a flight back home, Sam Hendrix returns with a doll he innocently acquired along the way. As it turns out, the doll is actually stuffed with heroin, and a group of criminals led by the ruthless Roat has followed Hendrix back to his place to retrieve it. When Hendrix leaves for business, the crooks make their move -- and find his blind wife, Susy, alone in the apartment. Soon, a life-threatening game begins between Susy and the thugs.",2.263772,/m44YjHFnLkExI8fiCriJyMqkkpu.jpg,1967-10-26,Wait Until Dark,False,7.51,41,Susy Hendrix,Roat / Roat Jr. / Roat Sr.,Mike Talman
32,False,/dYakGhfA6o1KBl73DBdwtR6Db5u.jpg,"[12, 14, 35, 10751, 10402, 10749]",16081,en,Doctor Dolittle,"Get ready for the wildest adventure of a lifetime in the most ambitious production ever brought to film. Earning a 1967 Academy Award nomination for Best Picture, this dazzling fantasy turns both ordinary and exotic animals into talking, dancing and singing sensations! Rex Harrison is unforgettable in this inspiring adaptation of Hugh Lofting's classic stories.Step into the English country home of the good doctor as he performs remarkable treatments on the wildest variety of patients you could imagine. Discover his secret cures and watch with wide-eyed excitement as he and his four-legged, fine-feathered friends charm their way into your heart!",1.609486,/odRPCp8hurrZpdrnRXm5oqn1DjH.jpg,1967-12-19,Doctor Dolittle,False,5.13,15,Dr. John Dolittle,Emma Fairfax,Albert Blossom
33,False,/janK1O6xf6aKqloCDHiFhCnHE5B.jpg,[37],27277,en,The War Wagon,"An ex-con seeks revenge on the man who put him in prison by planning a robbery of the latter's stagecoach, which is transporting gold. He enlists the help of a partner, who could be working for his nemesis.",2.251444,/jEWv3nWrK7K9MQq1ggLtVwU2IkS.jpg,1967-05-27,The War Wagon,False,6.3,15,Taw Jackson,Lomax,Levi Walking Bear
34,False,/u36EvB7jqnNDDziczFCashMA3QO.jpg,"[35, 10749]",2984,en,A Countess from Hong Kong,A Russian countess stows away in the stateroom of a married U.S. diplomat bound for New York.,1.334039,/20sih3KIfCERbSb15tLSfzmaAm9.jpg,1967-01-05,A Countess from Hong Kong,False,5.27,15,Ogden Mears,Natascha,Martha
35,False,/4Ji2gNelXkNBZHiYilA39Iwsy2e.jpg,"[80, 18, 36]",42702,en,The St. Valentine's Day Massacre,"Chicago February 14th 1929. Al Capone finally establishes himself as the city's boss of organised crime. In a north-side garage his hoods, dressed as policemen, surprise and mow down with machine-guns the key members of Bugs Moran's rival gang. The film traces the history of the incident, and the lives affected and in some cases ended by it.",1.328672,/kEg7EwtjpWqsFdG8QXTu1ldPFLa.jpg,1967-06-30,The St. Valentine's Day Massacre,False,5.14,7,Al Capone,Peter Gusenberg,George Clarence 'Bugs' Moran
36,False,/zK8vBG1F3QU77QAa7aft94Wzu5Z.jpg,"[35, 10402, 10749]",45335,en,Double Trouble,"When singer Gut Lambert goes on tour in Europe, he is pursued by two beautiful women, bumbling jewel thieves, and a mysterious killer.",1.250486,/1iI1tXX4IgB3WmqZ7FqRasn7cGk.jpg,1967-04-05,Double Trouble,False,5.25,2,Guy Lambert,Jill Conway,Gerald Waverly
37,False,/uC9xGDps26YSX0v1wSdUE81JjDa.jpg,"[80, 18, 53]",5511,fr,Le Samouraï,Hitman Jef Costello is a perfectionist who always carefully plans his murders and who never gets caught.,2.273214,/cvNW8IXigbaMNo4gKEIps0NGnhA.jpg,1967-10-25,Le Samouraï,False,7.55,75,Jef Costello,Superintendant,Jane Lagrange
38,False,/kOpCxzuN84AgK9QlXNoAwikebKC.jpg,"[35, 18]",1629,fr,La chinoise,"A small group of French students are studying Mao, trying to find out their position in the world and how to change the world to a Maoistic community using terrorism.",1.446467,/j9RwOcVFgPD3L9ktoUOYuejquJa.jpg,1967-08-30,La Chinoise,False,6.56,9,Véronique,Guillaume,Yvonne
39,False,/fCzGvnb0bHkzQwJR2HLWEDMZNqY.jpg,"[35, 18]",103613,fr,Le plus vieux métier du monde,"A collection of sketches on prostitution through the ages. 1) ""The Prehistoric Era"": A caveman discovers that a cavewoman is more attractive when cave paint is applied to her face. And she can earn more seashells that way. 2) ""Roman Nights"": The Emperor goes out seeking a little nocturnal amusement, only to find that the high-priced, Oriental courtesan he hires is his wife, the Empress. 3) ""Mademoiselle Mimi"": In revolutionary France, Mimi finds that her client, the nephew of a marquis, is more interested in watching the guillotinings out her window than he is in going to bed. 4) ""The Gay Nineties"": When Nini discovers by accident that her antiquated customer is a banker, she pretends to be an honest woman who has fallen in love with him. She even pays him, just like a gigolo! 5) ""Paris Today"": Two girls pick up clients by driving around in a car...",1.479269,/243doLHEx79kpwSk8SgLa0NaGrh.jpg,1967-04-21,The Oldest Profession,False,5.5,2,Brit,Mimi,Nini
40,False,/pckdZ29bHj11hBsV3SbVVfmCB6C.jpg,"[878, 9648, 12]",62,en,2001: A Space Odyssey,"Humanity finds a mysterious object buried beneath the lunar surface and sets off to find its origins with the help of HAL 9000, the world's most advanced super computer.",4.914553,/90T7b2LIrL07ndYQBmSm09yqVEH.jpg,1968-04-05,2001: A Space Odyssey,False,7.64,1565,Dr. Dave Bowman,HAL 9000 (voice),Dr. Frank Poole
41,False,/lS3pffg5eIZtnqa0OIHOoe0jdER.jpg,"[28, 80, 18, 53]",916,en,Bullitt,"Senator Walter Chalmers is aiming to take down mob boss Pete Ross with the help of testimony from the criminal's hothead brother Johnny, who is in protective custody in San Francisco under the watch of police lieutenant Frank Bullitt. When a pair of mob hitmen enter the scene, Bullitt follows their trail through a maze of complications and double-crosses. This thriller includes one of the most famous car chases ever filmed.",2.404981,/oyhnoFu2oKQfAIdu9YU8I8Ne0pX.jpg,1968-10-17,Bullitt,False,6.66,132,Lt. Frank Bullit,Cathy,Walter Chalmers
42,False,/ybVvtVQQ3ACmy4bab9xievII3cG.jpg,"[18, 10749]",6003,en,Romeo and Juliet,"Director Franco Zeffirelli's beloved version of one of the most well-known love stories in the English language. Romeo Montague and Juliet Capulet fall in love against the wishes of their feuding families. Driven by their passion, the young lovers defy their destiny and elope, only to suffer the ultimate tragedy.",2.467333,/bnagQOzwGcrDNhw5nxQl1kbOc2e.jpg,1968-04-03,Romeo and Juliet,False,6.97,65,Romeo,Juliet,Mercutio
43,False,/u4s4b3xRz5gOHwzO2KneDqIl7Bf.jpg,"[12, 878, 9648]",871,en,Planet of the Apes,Taylor and two other astronauts come out of deep hibernation to find that their ship has crashed. Escaping with little more than clothes they find that they have landed on a planet where men are pre-lingual and uncivilized while apes have learned speech and technology. Taylor is captured and taken to the city of the apes after damaging his throat so that he is silent and cannot communicate with the apes.,2.570502,/xnbIzl5eSpiooMA22PQAf7sfCns.jpg,1968-02-07,Planet of the Apes,False,7.21,432,George Taylor,Cornelius,Zira
44,False,/3THF7D3uPqhV6k7iKsr2EyjqVPK.jpg,"[27, 18, 9648]",805,en,Rosemary's Baby,A young couple moves into an infamous New York apartment building to start a family. Things become frightening as Rosemary begins to suspect her unborn baby isn't safe around their strange neighbors.,2.762271,/qSJYJ0FsP5DMJcn37fYVq0VhmNt.jpg,1968-06-12,Rosemary's Baby,False,7.28,417,Rosemary Woodhouse,Guy Woodhouse,Minnie Castevet
45,False,/aZBg3z7G2QkddfXRZ8H0MY2pgGT.jpg,"[12, 18, 28, 36, 10752]",11046,en,Where Eagles Dare,"World War II is raging, and an American general has been captured and is being held hostage in the Schloss Adler, a Bavarian castle that's nearly impossible to breach. It's up to a group of skilled Allied soldiers to liberate the general before it's too late.",1.856049,/70lTWYeTtQfQ9HVKE12ZS7r89jM.jpg,1968-12-04,Where Eagles Dare,False,6.84,109,"Maj. Jonathan Smith, MC",Lt. Morris Schaffer,Mary Elison
46,False,/lfD3hi4AVk05sTngDvybbuLVzqR.jpg,"[18, 10751, 10402]",17917,en,Oliver!,"Musical adaptation of Charles Dickens' Oliver Twist, a classic tale of an orphan who runs away from the workhouse and joins up with a group of boys headed by the Artful Dodger and trained to be pickpockets by master thief Fagan.",1.377292,/t44XtV1pNAKYrb5jIRFpcBo0XSe.jpg,1968-09-26,Oliver!,False,6.38,37,Fagin,Nancy,Bill Sikes
47,False,/j5td7oLm44DQF2D3Ml6mtXSOVlt.jpg,"[10749, 18, 10402]",52959,en,Star!,Gertrude Lawrence rises to stage stardom at the cost of happiness.,1.004211,/e4I6LDDCaQxBESDtPo0yemtF4JL.jpg,1968-07-18,Star!,False,7.0,2,Gertrude Lawrence,"Richard Aldrich, Producer",Sir Anthony Spencer
