,adult,backdrop_path,genre_ids,id,original_language,original_title,overview,popularity,poster_path,release_date,title,video,vote_average,vote_count,character0,character1,character2
752,False,/nnfORNm5LclB9zxN3TqDKFTGOvT.jpg,"[35, 10749, 18]",508,en,Love Actually,"Follows seemingly unrelated people as their lives begin to intertwine while they fall in, and out, of love. Affections languish and develop as Christmas draws near.",4.110938,/kfX8Ctin3fSZbdnjh6CXSNZUOVP.jpg,2003-09-07,Love Actually,False,6.86,1126,Billy Mack,Joe,Jamie Bennett
753,False,/8RkLHFm2PK4PO5W0WZA5LMXLZBz.jpg,"[28, 80, 53]",584,en,2 Fast 2 Furious,"It's a major double-cross when former police officer Brian O'Conner teams up with his ex-con buddy Roman Pearce to transport a shipment of ""dirty"" money for shady Miami-based import-export dealer Carter Verone. But the guys are actually working with undercover agent Monica Fuentes to bring Verone down.",1.646593,/hZVcmztCVo510FhBXyLqStiTAce.jpg,2003-06-01,2 Fast 2 Furious,False,6.12,1215,Brian O'Conner,Roman Pearce,Monica Fuentes
754,False,/5CDIezS2xJtcSXPL24Z2dIeUOp0.jpg,"[35, 10749]",8273,en,American Wedding,"With high school a distant memory, Jim and Michelle are getting married -- and in a hurry, since Jim's grandmother is sick and wants to see him walk down the aisle -- prompting Stifler to throw the ultimate bachelor party. And Jim's dad is reliable as ever, doling out advice no one wants to hear.",3.006723,/lcLuBjI3Hr12mGFKJvdMeZdf3AN.jpg,2003-08-01,American Wedding,False,6.02,608,Jim Levenstein,Michelle Flaherty,Steve Stifler
755,False,/n5vmQsgANMuALE5qyU3pdSB1nd1.jpg,[35],4256,en,Scary Movie 3,"In the third installment of the Scary Movie franchise, news anchorwoman Cindy Campbell has to investigate mysterious crop circles and killing video tapes, and help the President stop an alien invasion in the process.",2.987455,/jlzEF7sTseYDB9H5dN29YFZt5Na.jpg,2003-10-24,Scary Movie 3,False,5.61,421,Becca,Kate,Tabitha
756,False,/u2FxA8fDt0uQAnHKTwWGgkPShoL.jpg,"[12, 28, 878, 53]",36658,en,X2,"Professor Charles Xavier and his team of genetically gifted superheroes face a rising tide of anti-mutant sentiment led by Col. William Stryker in this sequel to the Marvel Comics-based blockbuster X-Men. Storm, Wolverine and Jean Grey must join their usual nemeses Magneto and Mystique to unhinge Stryker's scheme to exterminate all mutants.",1.128375,/8TAPuoephNAiRGgBobP4xQl0QGK.jpg,2003-04-24,X2,False,6.65,2106,Charles Xavier / Professor X,Logan / Wolverine,Eric Lensherr / Magneto
757,False,/68sGkVSVxuFw7J9H6sk4GZfYZ1q.jpg,[12],8619,en,Master and Commander: The Far Side of the World,"After an abrupt and violent encounter with a French warship inflicts severe damage upon his ship, a captain of the British Royal Navy begins a chase over two oceans to capture or destroy the enemy, though he must weigh his commitment to duty and ferocious pursuit of glory against the safety of his devoted crew, including the ship's thoughtful surgeon, his best friend.",3.81575,/4o4JyEQldHQiqJn0BBRFppDmI65.jpg,2003-11-14,Master and Commander: The Far Side of the World,False,6.58,409,Captain Jack Aubrey,Dr. Stephen Maturin,1st Lt. Tom Pullings
758,False,/7c2JZCf4pYYy5GNtvfFyGBYXLWp.jpg,"[28, 12, 35, 10751, 878]",12279,en,Spy Kids 3-D: Game Over,"Carmen's caught in a virtual reality game designed by the Kids' new nemesis, the Toymaker (Stallone). It's up to Juni to save his sister, and ultimately the world.",3.043842,/tethGDyocmatW6Li1NcUBXQo6Oo.jpg,2003-07-25,Spy Kids 3-D: Game Over,False,4.79,257,Gregorio Cortez,Ingrid Cortez,Carmen Cortez
759,False,/oxngOdJwaKDOwwkQHDTF47GZV4Q.jpg,[35],9506,en,Anger Management,"After a misunderstanding aboard an airplane that escalates out of control, the mild-mannered Dave Buznik is ordered by Judge Daniels to attend anger management sessions run by Doctor Buddy Rydell, which are filled with highly eccentric and volatile men and women. Buddy's unorthodox approach to therapy is confrontational and abrasive and Dave is bewildered by it. Then, after yet another mishap, Judge Daniels orders Dave to step up his therapy or wind up in jail. So, Buddy moves in with Dave to help him battle his inner demons. Buddy himself has no inner demons since he acts out at every opportunity and that includes making lewd comments about Dave's girlfriend Linda and goading Dave into confronting every slight, past or present, head-on. But Buddy finally goes too far and Dave must decide whether to crawl back into his shell or stand up for himself. Could it be that Buddy's confounding and contradictory treatment is just what the doctor ordered?",2.271741,/wsrZrb2Ng3eO4TYmeBufwdKeC3a.jpg,2003-04-11,Anger Management,False,5.86,470,Dave Buznik,Dr. Buddy Rydell,Lou
760,False,/nJ0TsLEeht6y30AMryc4ElQ8gzp.jpg,"[12, 16, 35, 10751, 14]",809,en,Shrek 2,"Shrek, Fiona and Donkey set off to Far, Far Away to meet Fiona's mother and father. But not everyone is happy. Shrek and the King find it hard to get along, and there's tension in the marriage. The fairy godmother discovers that Shrek has married Fiona instead of her Son Prince Charming and sets about destroying their marriage.",3.843753,/akWDA0BMVYK4OTM92T5i91DYnsT.jpg,2004-05-19,Shrek 2,False,6.52,1570,Shrek (voice),Donkey (voice),Princess Fiona (voice)
761,False,/wWdlIBxn9xCmySxnSWtI2BjZZkF.jpg,"[12, 14, 10751]",673,en,Harry Potter and the Prisoner of Azkaban,"Harry, Ron and Hermione return to Hogwarts for a third adventure and magic filled year in this follow-up to the first two Potter blockbusters. Harry comes face to face with danger yet again, this time in the form of escaped convict Sirius Black. In a bid for help, Harry turns to sympathetic Professor Lupin -- but will it be enough?",4.992977,/qMn0YCWKxt7xg8nqRnRj2Ei9qgx.jpg,2004-05-31,Harry Potter and the Prisoner of Azkaban,False,7.36,3290,Harry Potter,Ron Weasley,Hermione Granger
762,False,/p2frIQykQPj3dXSYVOca60RQj9X.jpg,"[28, 12, 14]",558,en,Spider-Man 2,"Peter Parker is going through a major identity crisis. Burned out from being Spider-Man, he decides to shelve his superhero alter ego, which leaves the city suffering in the wake of carnage left by the evil Doc Ock. In the meantime, Parker still can't act on his feelings for Mary Jane Watson, a girl he's loved since childhood.",2.249207,/qtBFrsEQ4oXW8sKvRxkKnYuPLg.jpg,2004-06-25,Spider-Man 2,False,6.39,2590,Peter Parker / Spider-Man,Mary Jane Watson,Harry Osborn
763,False,/iGknrkEyebPFmpQoLGy5L0utVxz.jpg,"[28, 12, 16, 10751, 878]",9806,en,The Incredibles,"Bob Parr has given up his superhero days to log in time as an insurance adjuster and raise his three children with his formerly heroic wife in suburbia. But when he receives a mysterious assignment, it's time to get back into costume.",4.7349,/9gBnaVySWaXulJNzR796Nd8kdje.jpg,2004-11-04,The Incredibles,False,7.2,2844,Bob Parr / Mr. Incredible (voice),Helen Parr / Elastigirl (voice),Lucius Best / Frozone (voice)
764,False,/tRiJ0hNbJp8raIvqDZXNFbIOdOi.jpg,[18],615,en,The Passion of the Christ,"""The Passion of the Christ"" is a film about the last 12 hours in the life of Jesus. Director Mel Gibson received much criticism from critics and audiences for his explicit depiction of and focus on violence and on christs suffering, especially on the part of the jewish community. The films languages are Arabic, Latin and Hebrew and its actors are laymen which was controversially received as well.",3.620455,/oFuLM1EaKhi1WNWiTjQ1HKIZ1Eg.jpg,2004-02-25,The Passion of the Christ,False,6.8,424,Jesus,Maria,Johannes
765,False,/5SSu3K3YFOn0ed478R1ZfsZ6hqc.jpg,"[28, 12, 878, 53]",435,en,The Day After Tomorrow,"After years of unabated global warming, the greenhouse effect is wreaking havoc all over the globe in the form of catastrophic hurricanes, tornadoes, tidal waves, floods and, most ominously, the beginning of the next Ice Age. Paleoclimatologist Jack Hall tries to save the world while also shepherding to safety his son Sam, who was in New York when the city was overwhelmed by the beginnings of the new big freeze.",2.251777,/qbEzEau8a7Tf0aVs3gMi5ylMrf1.jpg,2004-05-26,The Day After Tomorrow,False,6.09,1329,Jack Hall,Sam Hall,Laura Chapman
766,False,/f0eF1rB9KnZPonliSt8CazKvihD.jpg,"[35, 10749]",693,en,Meet the Fockers,"Hard-to-crack ex-CIA man, Jack Byrnes and his wife, Dina head for the warmer climes of Florida to meet son-in-law-to-be, Greg Focker's parents. Unlike their happily matched offspring, the future in-laws find themselves in a situation of opposites that definitely do not attract.",3.128897,/xHAqB06iL5D6HyOS6QpgyKkRQHD.jpg,2004-12-15,Meet the Fockers,False,6.06,723,Gaylord 'Greg' Focker,Pam Byrnes,Jack Byrnes
767,False,/lIyNUZbIeEwWpaWXAO5gnciB8Dq.jpg,"[10752, 12, 18]",652,en,Troy,"In year 1250 B.C. during the late Bronze age, two emerging nations begin to clash. Paris, the Trojan prince, convinces Helen, Queen of Sparta, to leave her husband Menelaus, and sail with him back to Troy. After Menelaus finds out that his wife was taken by the Trojans, he asks his brother Agamemnom to help him get her back. Agamemnon sees this as an opportunity for power. So they set off with 1,000 ships holding 50,000 Greeks to Troy. With the help of Achilles, the Greeks are able to fight the never before defeated Trojans.",3.763787,/edMlij7nw2NMla32xskDnzMCFBM.jpg,2004-05-13,Troy,False,6.76,1476,Achilles,Paris,Hector
768,False,/v3RnhCEMu9MVxA5aHWPgVzFGdSG.jpg,"[16, 28, 35, 10751]",10555,en,Shark Tale,"Oscar is a small fish whose big aspirations often get him into trouble. Meanwhile, Lenny is a great white shark with a surprising secret that no sea creature would guess: He's a vegetarian. When a lie turns Oscar into an improbable hero and Lenny becomes an outcast, the two form an unlikely friendship.",4.483641,/zSHqX4qklYrHMEcv2GiHG5UwVsz.jpg,2004-09-20,Shark Tale,False,5.76,783,Oscar (voice),Don Lino (voice),Angie (voice)
769,False,/5AZ8fm3SZ6ANigK1NtfbhPy6mbm.jpg,"[53, 80]",163,en,Ocean's Twelve,"Danny Ocean reunites with his old flame and the rest of his merry band of thieves in a caper concerning three huge heists in Rome, Paris and Amsterdam. But Europol agent Isabel Lahiri is hot on their heels.",3.68827,/oBJ8LF80wX8PzhnPcNO0E9lnmYA.jpg,2004-12-09,Ocean's Twelve,False,6.39,1293,Danny Ocean,Rusty Ryan,Isabel Lahiri
770,False,/a8MKD2z2UuptTaA26ueJVJk3GGb.jpg,"[12, 28, 53, 9648]",2059,en,National Treasure,"Modern treasure hunters, led by archaeologist Ben Gates, search for a chest of riches rumored to have been stashed away by George Washington, Thomas Jefferson and Benjamin Franklin during the Revolutionary War. The chest's whereabouts may lie in secret clues embedded in the Constitution and the Declaration of Independence, and Gates is in a race to find the gold before his enemies do.",4.073103,/luMoc56LLMWUt60vUNNpwxrbTNt.jpg,2004-11-08,National Treasure,False,6.36,1101,Ben Gates,Abigail Chase,Riley Poole
771,False,/iNeKWgcTqUJhBToaosUXgca2nSY.jpg,"[28, 878]",2048,en,"I, Robot","In the year 2035, where robots are common and abide by the three laws of robotics, a techno-phobic cop investigates an apparent suicide. Suspecting that a robot may be responsible for the death, his investigation leads him to believe that humanity may be in danger.",3.942084,/2mkFzf168xJrV6Leqq0bjqOlJCK.jpg,2004-07-15,"I, Robot",False,6.62,2193,Del Spooner,Susan Calvin,Sonny
772,False,/mXPoxiRny3VPH0iXJWXlyTq1mjo.jpg,"[16, 12, 10751, 14]",5255,en,The Polar Express,"This is the story of a young boy on Christmas Eve who boards a magical train that's headed to the North Pole. What unfolds is an an adventure which follows a doubting boy, who takes an extraordinary train ride to the North Pole; during this ride, he embarks on a journey of self-discovery which shows him that the wonder of life never fades for those who believe.",3.914165,/wOrvRSt0pOlQWLBQDAoRryfUrSm.jpg,2004-11-09,The Polar Express,False,6.3,756,Toothless Boy,,
773,False,/xL05gsaqt6p78L5rBC9fDJBRnEy.jpg,"[12, 28, 14, 9648, 53]",7131,en,Van Helsing,Famed monster slayer Gabriel Van Helsing (Hugh Jackman) is dispatched to Transylvania to assist the last of the Valerious bloodline in defeating Count Dracula. Anna Valerious (Kate Beckinsale) reveals that Dracula has formed an unholy alliance with Dr. Frankenstein's monster and is hell-bent on exacting a centuries-old curse on her family.,3.367325,/s2OPT5CZsZBQYAIlO9Mv4AimHvV.jpg,2004-05-05,Van Helsing,False,5.83,852,Van Helsing,Anna Valerious,Vladislaus Dracula
774,False,/hfih7VmwTgFYSg4a1ZVYojNDltv.jpg,"[28, 18, 53]",2502,en,The Bourne Supremacy,"When a CIA operation to purchase classified Russian documents is blown by a rival agent, who then shows up in the sleepy seaside village where Bourne and Marie have been living. The pair run for their lives and Bourne, who promised retaliation should anyone from his former life attempt contact, is forced to once again take up his life as a trained assassin to survive.",4.61337,/6a74OaZArLNNDHK9SdiLBUu2JYj.jpg,2004-07-23,The Bourne Supremacy,False,7.09,1864,Jason Bourne,Marie,Ward Abbott
775,False,/sWypV7T6AXwmpoSEGrmPkkSsAo0.jpg,"[18, 9648, 53]",6947,en,The Village,"When a willful young man tries to venture beyond his sequestered Pennsylvania hamlet, his actions set off a chain of chilling incidents that will alter the community forever.",3.008167,/yV9W1TFQxaBA9EPeIIrDH7xHFT0.jpg,2004-07-30,The Village,False,5.98,473,Ivy Walker,Lucius Hunt,Noah Percy
776,False,/cGyqa5PxiWSsG7NSw3ufCj0JW9k.jpg,"[14, 16, 12]",4935,ja,???????,"When Sophie, a shy young woman, is cursed with an old body by a spiteful witch, her only chance of breaking the spell lies with a self-indulgent yet insecure young wizard and his companions in his legged, walking home.",4.890552,/iMarB2ior30OAXjPa7QIdeyUfM1.jpg,2004-11-19,Howl's Moving Castle,False,8.0,1070,Hauru,Arechi no Majo,Karushifâ
777,False,/lCSjseei1M2vqmuzxadJUiL8x5D.jpg,"[35, 18]",594,en,The Terminal,"Viktor Navorski is a man without a country; his plane took off just as a coup d'etat exploded in his homeland, leaving it in shambles, and now he's stranded at Kennedy Airport, where he's holding a passport that nobody recognizes. While quarantined in the transit lounge until authorities can figure out what to do with him, Viktor simply goes on living – and courts romance with a beautiful flight attendant.",2.86748,/f4Dup6awDfDqAHKgWqNJ2HFw1qN.jpg,2004-06-17,The Terminal,False,6.98,1049,Viktor Navorski,Amelia Warren,Frank Dixon
778,False,/whhU7492W0fcZE73r1HNhfyc5uV.jpg,"[18, 80, 53]",1538,en,Collateral,Cab driver Max picks up a man who offers him $600 to drive him around. But the promise of easy money sours when Max realizes his fare is an assassin.,2.435045,/fmkv2eRuYCTq7A5jzMBNgoNe1vA.jpg,2004-08-04,Collateral,False,6.71,767,Vincent,Max,Annie
779,False,/o4OSztAvDYNDXkn9PJGbaQAO8VG.jpg,[18],70,en,Million Dollar Baby,"Despondent over a painful estrangement from his daughter, trainer Frankie Dunn isn't prepared for boxer Maggie Fitzgerald to enter his life. But Maggie's determined to go pro and to convince Dunn and his cohort to help her.",3.593447,/h4VZKi2Jt4VoBYJmtC4c3bO8KqM.jpg,2004-12-14,Million Dollar Baby,False,7.54,1246,Frankie Dunn,Maggie Fitzgerald,Eddie Scrap-Iron Dupris
780,False,/gzKW3emulMxIHzuXxZoyDB1lei9.jpg,"[12, 14, 10751]",674,en,Harry Potter and the Goblet of Fire,"Young wizard Harry Potter starts his fourth year at Hogwarts, competes in the treacherous Triwizard Tournament and faces the evil Lord Voldemort. Friends Ron and Hermione help Harry manage the pressure… but Voldemort lurks, awaiting his chance to destroy Harry and all that he stands for.",4.811612,/6sASqcdrEHXxUhA3nFpjrRecPD2.jpg,2005-11-05,Harry Potter and the Goblet of Fire,False,7.25,3185,Harry Potter,Ron Weasley,Hermione Granger
781,False,/wUYTfFbfPiZC6Lcyt1nonr69ZmK.jpg,"[878, 12, 28]",1895,en,Star Wars: Episode III - Revenge of the Sith,"Years after the onset of the Clone Wars, the noble Jedi Knights lead a massive clone army into a galaxy-wide battle against the Separatists. When the sinister Sith unveil a thousand-year-old plot to rule the galaxy, the Republic crumbles and from its ashes rises the evil Galactic Empire. Jedi hero Anakin Skywalker is seduced by the dark side of the Force to become the Emperor's new apprentice -- Darth Vader. The Jedi are decimated, as Obi-Wan Kenobi and Jedi Master Yoda are forced into hiding. The only hope for the galaxy are Anakin's own offspring -- the twin children born in secrecy who will grow up to become heroes.",3.467463,/tgr5Pdy7ehZYBqBkN2K7Q02xgOb.jpg,2005-05-17,Star Wars: Episode III - Revenge of the Sith,False,6.95,2467,Anakin Skywalker,Obi-Wan Kenobi,Padmé Amidala
782,False,/4ZwXJcUT3KdE8Kan9TJ7l0Rg5LG.jpg,"[12, 10751, 14]",411,en,"The Chronicles of Narnia: The Lion, the Witch and the Wardrobe","Join Lucy, Edmund, Susan, and Peter, four siblings who step through a magical wardrobe and find the land of Narnia. There, the they discover a charming, once peaceful kingdom that has been plunged into eternal winter by the evil White Witch, Jadis. Aided by the wise and magnificent lion Aslan, the children lead Narnia into a spectacular, climactic battle to be free of the Witch's glacial powers forever!",4.654432,/l8RKDgjl9co0IgFZblxhtIOi5Uj.jpg,2005-12-07,"The Chronicles of Narnia: The Lion, the Witch and the Wardrobe",False,6.47,1287,Peter Pevensie,Susan Pevensie,Edmund Pevensie
783,False,/bwTb66gicrB7HbkogwNs9V37Ddb.jpg,"[12, 53, 878]",74,en,War of the Worlds,"The extraordinary battle for the future of humankind through the eyes of one American family fighting to survive it. Ray Ferrier is a divorced dockworker and less-than-perfect father. Soon after his ex-wife and her new husband drop of his teenage son Robbie and young daughter Rachel for a rare weekend visit, a strange and powerful lightning storm touches down.",3.73854,/xXMM9KY2eq1SDOQif9zO91YOBA8.jpg,2005-06-28,War of the Worlds,False,5.92,1158,Ray Ferrier,Rachel Ferrier,Mary-Ann
784,False,/lWnPz1EvXUWMvXK1plZMA1I2XMV.jpg,"[12, 18, 28]",254,en,King Kong,"In 1933 New York, an overly ambitious movie producer coerces his cast and hired ship crew to travel to mysterious Skull Island, where they encounter Kong, a giant ape who is immediately smitten with leading lady Ann Darrow.",3.987748,/ueMFrWi2NTqvpDAUWh5lSewai8Q.jpg,2005-12-14,King Kong,False,6.36,1213,Ann Darrow,Carl Denham,Jack Driscoll
785,False,/wUetiqu2EFhHW94yTP0pWABfyUG.jpg,"[10751, 16]",953,en,Madagascar,"Zoo animals leave the comforts of man-made habitats for exotic adventure in this animated family film. After escaping from the zoo, four friends -- a lion, a hippo, a zebra and a giraffe -- are sent back to Africa. When their ship capsizes, stranding them on Madagascar, an island populated by crazy critters, the pals must adapt to jungle life and their new roles as wild animals.",3.949502,/2YiESGB68BGQSAFvfJxBi774sc4.jpg,2005-05-25,Madagascar,False,6.41,2014,Alex,Marty,Melman
786,False,/n4GhKs24bQK2XsdlZ5bZFljzlsK.jpg,"[28, 35, 18, 53]",787,en,Mr. & Mrs. Smith,"After five (or six) years of vanilla-wedded bliss, ordinary suburbanites John and Jane Smith (Pitt and Jolie) are stuck in a rut the size of the Grand Canyon?until the truth comes out! Unbeknownst to each other, they are both coolly lethal, highly paid assassins working for rival organizations. And when they discover they're each other's next target, their secret lives collide in a spicy, explosive mix of wicked comedy, pent-up passion, nonstop action and high-tech weaponry that gives an all-new meaning to ""Till death do us part!""",4.129047,/dqs5BmwSULtB28Kls3IB6khTQwp.jpg,2005-06-07,Mr. & Mrs. Smith,False,6.54,1635,Jane Smith,John Smith,Eddie
787,False,/mrRAx1OsNVEKJv0ktQprspieqnS.jpg,"[12, 35, 10751, 14]",118,en,Charlie and the Chocolate Factory,"A young boy wins a tour through the most magnificent chocolate factory in the world, led by the world's most unusual candy maker.",4.357063,/dvHl1dYvaZRhj9Gk0ITcCHr4DIJ.jpg,2005-07-09,Charlie and the Chocolate Factory,False,6.47,1653,Willy Wonka,Charlie Bucket,Violet Beauregarde
788,False,/65JWXDCAfwHhJKnDwRnEgVB411X.jpg,"[28, 80, 18]",272,en,Batman Begins,"Driven by tragedy, billionaire Bruce Wayne dedicates his life to uncovering and defeating the corruption that plagues his home, Gotham City.  Unable to work within the system, he instead creates a new identity, a symbol of fear for the criminal underworld - The Batman.",5.658923,/dr6x4GyyegBWtinPBzipY02J2lV.jpg,2005-06-14,Batman Begins,False,7.34,4676,Bruce Wayne / Batman,Alfred Pennyworth,Henri Ducard
789,False,/4aur0Sum8KnL5XZU0tNDjRJDUtC.jpg,"[35, 18, 10749]",8488,en,Hitch,"Dating coach Alex ""Hitch"" Hitchens (Will Smith) mentors a bumbling client, Albert (Kevin James), who hopes to win the heart of the glamorous Allegra Cole (Amber Valletta). While Albert makes progress, Hitchens faces his own romantic setbacks when proven techniques fail to work on Sara Melas (Eva Mendes), a tabloid reporter digging for dirt on Allegra Cole's love life. When Sara discovers Hitchens' connection to Albert -- now Allegra's boyfriend -- it threatens to destroy both relationships.",2.579224,/wY1AsrhhymgxVruhkPtfBoLnUA3.jpg,2005-02-10,Hitch,False,6.32,936,Alex 'Hitch' Hitchens,Sara Melas,Albert Brennaman
790,False,/2yBWCL0RPJ6Av8LWxcrhuMRlZyG.jpg,"[28, 12, 14, 878]",9738,en,Fantastic Four,"During a space voyage, four scientists are altered by cosmic rays: Reed Richards gains the ability to stretch his body; Sue Storm can become invisible; Johnny Storm controls fire; and Ben Grimm is turned into a super-strong … thing. Together, these ""Fantastic Four"" must now thwart the evil plans of Dr. Doom and save the world from certain destruction.",3.552163,/aJwUBmUA11lkNVSJ3if3h3xHSFd.jpg,2005-07-07,Fantastic Four,False,5.55,1603,Reed Richards / Mr. Fantastic,Sue Storm / Invisible Woman,Johnny Storm / Human Torch
791,False,/tsuO7UaOZGY1Lm6LeQgpSuJq0Y.jpg,"[16, 10751, 35]",9982,en,Chicken Little,"When a tiny acorn bonks Chicken Little on the head, he causes widespread panic and gets on the bad side of the entire town. But when he's hit on the head by a real piece of sky, it's up to Chicken Little and his friends to save the world.",4.556765,/iLMALbInUmbNn1tHmxJEWm5MyjP.jpg,2005-02-12,Chicken Little,False,5.59,501,Chicken Little (voice),Buck Cluck (voice),Mayor Turkey Lurkey (voice)
792,False,/4V0hNC6SEbm836eg2BeaJvx1ZEO.jpg,"[35, 10749]",9522,en,Wedding Crashers,"John and his buddy, Jeremy are emotional criminals who know how to use a woman's hopes and dreams for their own carnal gain. Their modus operandi: crashing weddings. Normally, they meet guests who want to toast the romantic day with a random hook-up. But when John meets Claire, he discovers what true love – and heartache – feels like.",2.944401,/vlnDz1Y3IcBhPyQAqAVtNghx4Eq.jpg,2005-07-14,Wedding Crashers,False,6.26,721,John Beckwith,Jeremy Grey,Secretary William Cleary
793,False,/okEMRef9hgVzTUo2U6OaCSk0t0M.jpg,"[16, 35, 10751, 878]",9928,en,Robots,"Rodney Copperbottom is a young robot inventor who dreams of making the world a better place … until the evil Ratchet takes over Big Weld Industries. Now, Rodney's dreams -- like those of his friends, including motor-mouthed Fender -- are in danger of becoming obsolete.",3.523594,/12n6dEayPtv7CqgbeSkznFQSKzh.jpg,2005-03-11,Robots,False,5.86,814,Fender (voice),Rodney Copperbottom (voice),Cappy (voice)
794,False,/bGXup8uvaIrp6mLisZ8AJtl6DNA.jpg,"[18, 14, 27]",561,en,Constantine,"Constantine tells the story of John Constantine, a man who has literally been to Hell and back. When he teams up with a policewoman to solve the mysterious suicide of her twin sister, their investigation takes them through the world of demons and angels that exists beneath the landscape of contemporary Los Angeles.",2.746904,/qYTerimWp1t1zSEKknn9mByhwbX.jpg,2005-02-15,Constantine,False,6.49,994,John Constantine,Angela Dodson / Isabel Dodson,Chas Kramer
795,False,/qSewyN6JIqlmI3HMjKX8Lbfw8T8.jpg,"[53, 18, 9648]",9315,en,Flightplan,"A claustrophobic, Hitchcockian thriller. A bereaved woman and her daughter are flying home from Berlin to America. At 30,000 feet the child vanishes and nobody admits she was ever on that plane.",2.368165,/pZetr5lKqN12sRLDvgW7UUxfYtj.jpg,2005-09-22,Flightplan,False,5.99,402,Kyle Pratt,Carson,Captain Rich
796,False,/kxRYuGjccUCR1M0ZuG1TbzkMb7Y.jpg,"[18, 28, 12, 36, 10752]",1495,en,Kingdom of Heaven,"After his wife dies, a blacksmith named Balian is thrust into royalty, political intrigue and bloody holy wars during the Crusades.",3.49971,/d9GYuT9aMoDi4MPTKYe4M2PwUm4.jpg,2005-05-03,Kingdom of Heaven,False,6.38,635,Balian de Ibelin,Sibylla,Tiberias
797,False,/gEXvIMvCT1TuQY7Lu9vN47MpSm4.jpg,[35],7552,en,Fun with Dick and Jane,"After losing their high-paying corporate jobs, Jane and Dick Harper turn to robbing banks to maintain their upwardly mobile standard of living. Originally an act of desperation, they soon begin to enjoy it – and now it's getting to be a habit.",2.030666,/pja5sDJEmh7EBJ5scx5qp6N9Fqw.jpg,2005-12-21,Fun with Dick and Jane,False,5.92,344,Dick Harper,Jane Harper,Jack McCallister
798,False,/v45E1vDhPp2hc1dEZx5KZuRsSxX.jpg,"[12, 16, 35, 10751]",533,en,The Curse of the Were-Rabbit,"Cheese-loving eccentric Wallace and his cunning canine pal, Gromit, investigate a mystery in Nick Park's animated adventure, in which the lovable inventor and his intrepid pup run a business ridding the town of garden pests. Using only humane methods that turn their home into a halfway house for evicted vermin, the pair stumble upon a mystery involving a voracious vegetarian monster that threatens to ruin the annual veggie-growing contest.",3.947392,/tLryx0x9TDV5rifA9W8yUvDZFHB.jpg,2005-09-04,The Curse of the Were-Rabbit,False,6.59,349,Wallace / Hutch,Lady Campanula Tottington,Victor Quartermaine
